Course #	Dep	ID	Course Name	SBC	Credits
EST 327	EST	327	Systems Engineering Management, Elements of Product Design and Development		3
EST 330	EST	330	Natural Disasters: Societal Impacts and Technological Solutions	STAS	3
EST 331	EST	331	Engineering Ethics	STAS	3
EST 339	EST	339	Benevolent Computing		3
EST 341	EST	341	Waste Treatment Technologies	TECH	3
EST 342	EST	342	Industrial Engineering, Intro to Operations Research I		3
EST 344	EST	344	Technical Writing		3
EST 364	EST	364	How to Build a Startup	EXP+	3
EST 371	EST	371	Data Science Management		3
EST 372	EST	372	The Mobile Revolution in Development		3
EST 388	EST	388	Special Topics in Technological Systems Management		1
EST 389	EST	389	Special Topics in Technological Systems Management		3
EST 391	EST	391	Technology Assessment	STAS	3
EST 392	EST	392	Engineering Economics	SBS	3
EST 393	EST	393	Project Management		3
EST 440	EST	440	Interdisciplinary Research Methods	CER ESI EXP+ SBS+ SPK STEM+ WRTD	3
EST 441	EST	441	Interdisciplinary Senior Project	CER ESI EXP+ SBS+ SPK STEM+ WRTD	3
EST 475	EST	475	Undergraduate Teaching Practicum	EXP+	3
EST 488	EST	488	Internship in Technology and Society	EXP+	1-3
EST 499	EST	499	Research in Technology and Society	EXP+	0-3
EUR 101	EUR	101	Foundations of European Culture	GLO	3
EUR 201	EUR	201	Development of European Culture	HUM	3
EUR 390	EUR	390	Special Topics in European Studies	ARTS HFA+	3
EUR 401	EUR	401	Senior Research Seminar in European Studies	ESI WRTD	3
EUR 444	EUR	444	Experiential Learning	EXP+	0
EUR 447	EUR	447	Directed Readings in European Studies		1-6
EUR 458	EUR	458	Speak Effectively Before an Audience	SPK	0
EUR 459	EUR	459	Write Effectively in European Studies	WRTD	0
EUR 475	EUR	475	Undergraduate Teaching Practicum in European Studies I	EXP+	3
EUR 476	EUR	476	Undergraduate Teaching Practicum in European Studies II	EXP+	3
EUR 487	EUR	487	Independent Project in European Studies		0-6
EUR 488	EUR	488	Internship in European Studies	EXP+	0-6
EUR 495	EUR	495	Senior Honors Project in European Studies		3
EXT 288	EXT	288	Externship: Applied Learning for Career Readiness	EXP+	0-3
EXT 488	EXT	488	Externship: Applied Learning for Career Readiness II	EXP+	0-6
FLA 307	FLA	307	Critical Pedagogy		3
FLA 339	FLA	339	Methods and Materials in the Teaching of Foreign Languages		3
FLA 340	FLA	340	Curriculum Development and Micro-Teaching	CER EXP+ SPK	3
FLA 400	FLA	400	Experiential Learning, Speak Effectively, Practice Critical and Ethical Reasoning	CER EXP+ SPK	0
FLA 439	FLA	439	Technology Literacy for Foreign Language Teachers	TECH	3
FLA 440	FLA	440	Foreign Language Acquisition Research		3
FLA 449	FLA	449	Field Experience, Grades 7-12		1
FLA 450	FLA	450	Field Experience, Grades 7-12	CER EXP+ SPK	1
FLA 451	FLA	451	Supervised Student Teaching: Middle School Level Grades 7-9	CER EXP+ SPK	6
FLA 452	FLA	452	Supervised Student Teaching: High School Grades 10-12	CER EXP+ SPK	6
FLA 454	FLA	454	Student Teaching Seminar	CER EXP+ SPK	3
FLM 101	FLM	101	Introduction to Filmmaking and Television: Visual Storytelling	ARTS	3
FLM 102	FLM	102	Introduction to Film and Television Composition: How Films and TV Shows Say What They Mean	HUM	3
FLM 215	FLM	215	Scriptwriting for Film and Television	HFA+	3
FLM 220	FLM	220	Documentary Filmmaking	HFA+	3
FLM 221	FLM	221	Fiction Filmmaking	HFA+	3
FLM 301	FLM	301	The Filmmaker's Toolbox: Cinematography, Sound and Editing	TECH	3
FLM 302	FLM	302	Producing Practices for Film and Television: Producing and Directing	SPK	3
FLM 303	FLM	303	Podcasting: Audio Storytelling Skills for Filmmakers	SPK	3
FLM 310	FLM	310	Story Analysis for Filmmakers and Television Writers	HFA+	3
FLM 320	FLM	320	Topics in Film for Filmmakers and Television Writers	HFA+	3
FLM 402	FLM	402	Capstone Project	EXP+	3
FLM 488	FLM	488	Internship	EXP+	3
FRN 101	FRN	101	Intensive Elementary French	LANG	6
FRN 111	FRN	111	Elementary French I	LANG	4
FRN 112	FRN	112	Elementary French II	LANG	4
FRN 201	FRN	201	Intensive Intermediate French	GLO HUM LANG	6
FRN 211	FRN	211	Intermediate French 1	GLO LANG	3
FRN 212	FRN	212	Intermediate French 2	GLO HUM LANG	3
FRN 311	FRN	311	Conversation	HFA+ LANG SPK	3
FRN 312	FRN	312	Composition	ESI HFA+ LANG WRTD	3
FRN 313	FRN	313	French Vocabulary through Popular Culture	HFA+	3
FRN 395	FRN	395	Readings in French Literature I: Analysis and Interpretation	HFA+	3
FRN 396	FRN	396	Readings in French Literature II: Analysis and Interpretation	HFA+	3
FRN 410	FRN	410	Business French	SBS+	3
FRN 411	FRN	411	Phonetics and Diction	HFA+	3
FRN 412	FRN	412	Stylistics	HFA+ WRTD	3
FRN 413	FRN	413	Advanced French Conversation	HFA+	3
FRN 423	FRN	423	Africana Literature in French	HFA+	3
FRN 433	FRN	433	Studies in 17th-Century Literature	HFA+	3
FRN 434	FRN	434	Studies in 18th-Century Literature	HFA+	3
FRN 435	FRN	435	Studies in 19th-Century Literature	HFA+	3
FRN 436	FRN	436	Studies in 20th-Century Literature	HFA+	3
FRN 438	FRN	438	Francophone cultures	HFA+	3
FRN 441	FRN	441	French Civilization	HFA+	3
FRN 442	FRN	442	Free Seminar	HFA+	3
FRN 444	FRN	444	Experiential Learning	EXP+	0
FRN 447	FRN	447	Directed Readings in French	EXP+	1-6
FRN 459	FRN	459	Write Effectively in French	WRTD	0
FRN 475	FRN	475	Undergraduate Teaching Practicum in French I	EXP+	3
FRN 476	FRN	476	Undergraduate Teaching Practicum in French II	EXP+	3
FRN 488	FRN	488	Internship	EXP+	0-6
FRN 495	FRN	495	Senior Honors Project in French	EXP+	3
GEO 101	GEO	101	Environmental Geology	SNW	3
GEO 102	GEO	102	The Earth	SNW	3
GEO 103	GEO	103	The Earth Through Time	SNW	3
GEO 104	GEO	104	Ripples across the World: Global Effects of Natural Disasters	GLO	3
GEO 105	GEO	105	Energy Resources for the 21st Century	SNW	3
GEO 106	GEO	106	Planetary Geology	SNW	3
GEO 107	GEO	107	Natural Hazards	SNW	3
GEO 112	GEO	112	Physical Geology Laboratory		1
GEO 113	GEO	113	Historical Geology Laboratory		1
GEO 115	GEO	115	Making the Invisible Visible: Polarized light microscopy	TECH	1
GEO 121	GEO	121	Principles of Geology		4
GEO 122	GEO	122	Physical Geology	SNW	4
GEO 287	GEO	287	Introductory Research in Geology	ESI	0-3
GEO 303	GEO	303	Sedimentary Geology and Geochronology (with emphasis on the Turkana Basin)	SNW	3
GEO 304	GEO	304	Energy, Mineral Resources, and the Environment	STAS	3
GEO 305	GEO	305	Field Geology	EXP+	3
GEO 306	GEO	306	Mineralogy		3
GEO 307	GEO	307	Global Environmental Change	STAS	3
GEO 309	GEO	309	Structural Geology		3
GEO 310	GEO	310	Introduction to Geophysics		3
GEO 311	GEO	311	Geoscience and Global Concerns	STAS	3
GEO 313	GEO	313	Understanding Water Resources for the 21st Century	ESI STAS	3
GEO 315	GEO	315	Groundwater Hydrology		3
GEO 316	GEO	316	Geochemistry of Surficial Processes		4
GEO 318	GEO	318	Engineering Geology and Coastal Processes	STEM+	3
GEO 320	GEO	320	Glacial Geology	STEM+	3
GEO 330	GEO	330	The Geology of Mars	ESI	3
GEO 347	GEO	347	Remote Sensing		3
GEO 366	GEO	366	Mineralogy Laboratory	TECH	1
GEO 369	GEO	369	Structural Geology Laboratory		1
GEO 403	GEO	403	Sedimentation and Stratigraphy		3
GEO 404	GEO	404	Geomorphology	STEM+	3
GEO 405	GEO	405	Field Camp		1-6
GEO 407	GEO	407	Igneous and Metamorphic Petrology	STEM+	3
GEO 420	GEO	420	Environmental Analysis Using Remote Sensing and Geographic Information Systems	TECH	4
GEO 444	GEO	444	Experiential Learning	EXP+	0
GEO 447	GEO	447	Senior Tutorial in Geology		1-3
GEO 448	GEO	448	Geosciences Colloquium		1
GEO 463	GEO	463	Sedimentation and Stratigraphy Laboratory		1
GEO 467	GEO	467	Igneous and Metamorphic Petrology Laboratory	STEM+	1
GEO 475	GEO	475	Undergraduate Teaching Practicum I	EXP+	3
GEO 476	GEO	476	Undergraduate Teaching Practicum II	EXP+	3
GEO 487	GEO	487	Senior Research in Geology	ESI EXP+	0-6
GEO 488	GEO	488	Internship	EXP+	0-6
GEO 496	GEO	496	Research and Synthesize Scientific Literature in Geoscience	ESI WRTD	1
GEO 497	GEO	497	Research Communication in Geoscience	CER SPK	1
GER 101	GER	101	Intensive Elementary German	LANG	6
GER 111	GER	111	Elementary German I	LANG	4
GER 112	GER	112	Elementary German II	LANG	4
GER 211	GER	211	Intermediate German I	GLO LANG	3
GER 212	GER	212	Intermediate German II	GLO HUM LANG	3
GER 311	GER	311	German Conversation and Composition	HFA+ SPK	3
GER 312	GER	312	German Conversation and Composition	ESI HFA+ WRTD	3
GER 313	GER	313	German Vocabulary in Conceptual Groups	HFA+	3
GER 343	GER	343	Introduction to Literary Genres	HFA+	3
GER 438	GER	438	Structure of German	HFA+	3
GER 439	GER	439	History of German	HFA+	3
GER 444	GER	444	Experiential Learning	EXP+	0
GER 447	GER	447	Directed Readings in German	EXP+	1-6
GER 459	GER	459	Write Effectively in German	WRTD	0
GER 475	GER	475	Undergraduate Teaching Practicum in German I	EXP+	3
GER 476	GER	476	Undergraduate Teaching Practicum in German II	EXP+	3
GER 488	GER	488	Internship	EXP+	0-6
GER 495	GER	495	Senior Honors Project in German	EXP+	3
GLI 102	GLI	102	Academy of Civic Life	USA	3
GLI 211	GLI	211	Perspectives in Globalization Studies and International Relations	SBS SPK	3
GLI 212	GLI	212	Issues in Globalization Studies and International Relations	GLO HUM	3
GLI 320	GLI	320	Global, Cultural, and Environmental Issues	STAS	3
GLI 330	GLI	330	Global, Political, and Economic Issues	SBS+	3
GLI 340	GLI	340	Conflict Resolution, Coalition Building, and Peacemaking	CER	3
GLI 391	GLI	391	Humanities and Fine Arts Topics in Globalization Studies	GLO HFA+	3
GLI 392	GLI	392	Social and Behavioral Sciences Topics in Globalization Studies	GLO SBS+	3
GLI 402	GLI	402	Democracy and Justice for All	EXP+ USA	3
GLI 444	GLI	444	Experiential Learning	EXP+	0
GLI 450	GLI	450	Capstone Seminar in Globalization Studies and International Relations	ESI SPK WRTD	3
GLI 458	GLI	458	Speak Effectively Before an Audience	SPK	0
GLI 459	GLI	459	Write Effectively in Globalization Studies and International Relations	SPK	0
GLI 475	GLI	475	Undergraduate Teaching Practicum I	EXP+	3
GLI 476	GLI	476	Undergraduate Teaching Practicum II	EXP+	3
GLI 487	GLI	487	Independent Research in Globalization Studies and International Relations	EXP+	0-6
GLI 488	GLI	488	Internship	EXP+	0-6
GLI 495	GLI	495	Senior Honors Project in Globalization Studies and International Relations		3
GRK 101	GRK	101	Intensive Elementary Modern Greek	LANG	6
GRK 111	GRK	111	Elementary Ancient Greek I	LANG	4
GRK 112	GRK	112	Elementary Ancient Greek II	LANG	4
GRK 121	GRK	121	Elementary Modern Greek I	LANG	3
GRK 122	GRK	122	Elementary Modern Greek II	LANG	3
GRK 211	GRK	211	Intermediate Modern Greek I	GLO LANG	3
GRK 212	GRK	212	Intermediate Modern Greek II	GLO HUM LANG	3
GRK 321	GRK	321	Advanced Modern Greek I	HFA+ LANG	3
GRK 322	GRK	322	Advanced Modern Greek II	HFA+ LANG	3
GSS 105	GSS	105	Introduction to Maps and Mapping	SBS	3
GSS 309	GSS	309	GIS and Cartography		3
GSS 313	GSS	313	GIS Design and Application I	TECH	3
GSS 314	GSS	314	GIS Laboratory		1
GSS 317	GSS	317	Geospatial Narratives: Deep Mapping for Humanities and Social Sciences	TECH	3
GSS 323	GSS	323	GIS Database and Design		3
GSS 325	GSS	325	GIS Design & Applications II		3
GSS 326	GSS	326	GIS Project Management		3
GSS 350	GSS	350	Applied Spatial Data Analysis	STEM+	3
GSS 354	GSS	354	Geospatial Science for the Coastal Zone		3
GSS 355	GSS	355	Remote Sensing GIS Data	STEM+	3
GSS 360	GSS	360	LiDAR Remote Sensing		3
GSS 390	GSS	390	Topics in Geospatial Science		3
GSS 475	GSS	475	Undergraduate Teaching Practicum	EXP+	0-3
GSS 487	GSS	487	Geospatial Science Research	EXP+	0-6
GSS 488	GSS	488	Geospatial Science Internship	EXP+	0-1
HBW 101	HBW	101	Intensive Elementary Hebrew	LANG	6
HBW 111	HBW	111	Elementary Hebrew I	LANG	3
HBW 112	HBW	112	Elementary Hebrew II	LANG	3
HBW 211	HBW	211	Intermediate Hebrew I	GLO LANG	3
HBW 212	HBW	212	Intermediate Hebrew II	GLO HUM LANG	3
HBW 311	HBW	311	Advanced Hebrew I	HFA+ LANG	3
HBW 312	HBW	312	Advanced Hebrew II	HFA+ LANG	3
HBW 405	HBW	405	Studies in Hebrew Literature	HFA+	3
HBW 415	HBW	415	The History of the Hebrew Language	HFA+	3
HBW 447	HBW	447	Directed Readings in Hebrew	EXP+	1-4
HBW 475	HBW	475	Undergraduate Teaching Practicum I	EXP+	3
HBW 476	HBW	476	Undergraduate Teaching Practicum II	EXP+	3
HIN 111	HIN	111	Elementary Hindi I	LANG	3
HIN 112	HIN	112	Elementary Hindi II	LANG	3
HIN 211	HIN	211	Intermediate Hindi I	GLO LANG	3
HIN 212	HIN	212	Intermediate Hindi II	GLO HUM LANG	3
HIN 311	HIN	311	Hindi Conversation and Composition I	HFA+ LANG	3
HIN 312	HIN	312	Hindi Conversation and Composition II	HFA+ LANG SPK	3
HIS 100	HIS	100	The Ancient World	GLO SBS	3
HIS 101	HIS	101	Ancient Mesopotamia to Early Modern Europe	GLO SBS	3
HIS 102	HIS	102	Modern European History, 18th c. to the Present	GLO SBS	3
HIS 103	HIS	103	American History to 1877	DIV SBS USA	3
HIS 104	HIS	104	United States Since 1877	DIV SBS USA	3
HIS 113	HIS	113	America in the Atlantic World	GLO SBS USA	3
HIS 116	HIS	116	Women as a Force in US History	SBS USA	3
HIS 201	HIS	201	The Ancient Near East	GLO	3
HIS 202	HIS	202	Ancient Greece	GLO	3
HIS 203	HIS	203	Ancient Rome	GLO	3
HIS 206	HIS	206	Europe in the Age of Discovery, 1348-1789	GLO SBS	3
HIS 212	HIS	212	Ancient History of Mesoamerica	GLO	3
HIS 213	HIS	213	Colonial Latin America	GLO SBS	3
HIS 214	HIS	214	Modern Latin America	GLO SBS	3
HIS 215	HIS	215	Long Island History	SBS USA	3
HIS 216	HIS	216	History of U.S.-Latin American Relations	GLO SBS	3
HIS 218	HIS	218	Ancient, Medieval, & Early Modern South Asia	GLO HUM	3
HIS 220	HIS	220	Japan in the Age of Courtier and Samurai	GLO SBS	3
HIS 221	HIS	221	Introduction to Modern African History	GLO SBS	3
HIS 223	HIS	223	Regional History of Africa	GLO SBS	3
HIS 225	HIS	225	Jewish History from Antiquity to the Middle Ages	CER GLO	3
HIS 226	HIS	226	Modern Jewish History: Dilemmas of Difference	GLO SBS	3
HIS 227	HIS	227	Islamic Civilization & Muslim Societies	GLO SBS	3
HIS 229	HIS	229	Victorian Britain	GLO SBS	3
HIS 230	HIS	230	Britain since 1688: Four Nations in the World	GLO SBS	3
HIS 235	HIS	235	The Heirs of Rome: The Early Medieval World, 300-1000	GLO	3
HIS 236	HIS	236	The World of the Later Middle Ages, 1000-1500	GLO	3
HIS 237	HIS	237	Science, Technology, and Medicine in Western Civilization I	STAS	3
HIS 238	HIS	238	Science, Technology, and Medicine in Western Civilization II	STAS	3
HIS 239	HIS	239	From Columbus to Darwin: Investigating Nature, Medicine, and Science in the Americas	ESI SPK STAS	3
HIS 241	HIS	241	Nazi Genocide and the Holocaust	GLO	3
HIS 247	HIS	247	Modern Korea through Visual Culture	GLO SBS	3
HIS 248	HIS	248	Modern Europe, 1815-1914	GLO	3
HIS 249	HIS	249	Modern Europe, 1914-1945	GLO	3
HIS 250	HIS	250	The Second World War, 1939-1945	GLO SBS	3
HIS 251	HIS	251	Europe Since 1945	GLO	3
HIS 256	HIS	256	Tacos to Telenovelas: Latin American Popular Culture	DIV GLO SBS	3
HIS 261	HIS	261	Change and Reform in the United States, 1877-1919	USA	3
HIS 262	HIS	262	American Colonial Society	DIV SBS USA	3
HIS 263	HIS	263	Age of the American Revolution	SBS USA	3
HIS 264	HIS	264	The Early Republic	DIV USA	3
HIS 265	HIS	265	Civil War and Reconstruction	DIV USA	3
HIS 266	HIS	266	History of the United States West	USA	3
HIS 273	HIS	273	U.S. History, 1900-1945	SBS USA	3
HIS 274	HIS	274	U.S. History, 1945-2000	SBS USA	3
HIS 277	HIS	277	The Modern Color Line	USA	3
HIS 280	HIS	280	The History of the U.S. Working Class	SBS USA	3
HIS 281	HIS	281	Global History and Geography	STAS	3
HIS 282	HIS	282	African American History Since 1877	SBS USA	3
HIS 283	HIS	283	The History of Latinos in the United States	DIV SBS USA	3
HIS 285	HIS	285	Games, Burlesques, and Spectacles: Popular Culture in 19th-Century America	SBS USA	3
HIS 286	HIS	286	The Global History of Human Health	GLO SBS	3
HIS 287	HIS	287	Crime and Criminal Justice in the U.S.	SBS USA	3
HIS 288	HIS	288	Wealth and Inequality in Early America	DIV SBS USA	3
HIS 289	HIS	289	Wealth and Inequality in America's Corporate Age	SBS USA	3
HIS 293	HIS	293	Disease in American History	STAS	3
HIS 295	HIS	295	History of North American Cities and Suburbs	SBS USA	3
HIS 299	HIS	299	College Regional Studies Program	SBS USA	3
HIS 300	HIS	300	Topics in Global History	SBS+	3
HIS 301	HIS	301	Reading and Writing History	ESI	3
HIS 302	HIS	302	Environmental History in Global Perspective	STAS	3
HIS 303	HIS	303	The Crusades and Medieval Society	SBS+	3
HIS 304	HIS	304	Religion, Magic and Witchcraft in Early Modern Europe	SBS+	3
HIS 307	HIS	307	Silk Roads and Spice Routes: Travel, Exploration and Discovery in the Premodern World	DIV GLO SBS+	3
HIS 308	HIS	308	Britain and France in the Age of Revolution	SBS+	3
HIS 309	HIS	309	Victorian Britain and Monsters: A Peculiar History of Empire	DIV SBS+	3
HIS 310	HIS	310	Britain Since 1945: Postcolonial Disruptions	DIV SBS+	3
HIS 312	HIS	312	From Empire to Third Reich: Germany, 1890-1945	SBS+	3
HIS 314	HIS	314	Indigenous-Settler Relations in the United States	CER DIV SBS+	3
HIS 315	HIS	315	Nazi Empire	GLO SBS+	3
HIS 318	HIS	318	Modern European Intellectual History	SBS+	3
HIS 320	HIS	320	Latino New York	DIV SBS+ SPK	3
HIS 323	HIS	323	Women of Color in the U.S.	DIV SBS+	3
HIS 325	HIS	325	Civil Rights and Black Power	SBS+	3
HIS 327	HIS	327	The Arts as History	HFA+ SBS+	3
HIS 328	HIS	328	History of New York City	SBS+	3
HIS 329	HIS	329	Environmental Disasters	STAS	3
HIS 331	HIS	331	Immigration in American History	DIV SBS+	3
HIS 332	HIS	332	Postcolonial South Asia	ESI SBS+	3
HIS 334	HIS	334	Women and Gender in Pre-Modern European History	SBS+	3
HIS 336	HIS	336	Women and Gender in Modern European History	SBS+	3
HIS 337	HIS	337	History of Korea	SBS+	3
HIS 338	HIS	338	Asian and Pacific Islanders in American History	SBS+	3
HIS 339	HIS	339	Recent African American History	SBS+ USA	3
HIS 340	HIS	340	Topics in Asian History	GLO SBS+	3
HIS 344	HIS	344	Modern Japan	GLO SBS+	3
HIS 348	HIS	348	Colonial South Asia	CER SBS+	3
HIS 350	HIS	350	Topics in African History	SBS+	3
HIS 351	HIS	351	Revolutionary China: Politics, Culture, and Power	SBS+	3
HIS 352	HIS	352	Environmental History of China	STAS	3
HIS 353	HIS	353	Postwar Japan	GLO SBS+	3
HIS 356	HIS	356	Zionism, Israel, and the Middle East	CER SBS+	3
HIS 360	HIS	360	Changing Families: US History to 1860	DIV SBS+	3
HIS 361	HIS	361	Slavery and Freedom in the Making of the Atlantic	CER DIV SBS+	3
HIS 362	HIS	362	Unsettled Decade: The Sixties	SBS+	3
HIS 363	HIS	363	Topics in American History	SBS+	3
HIS 364	HIS	364	Oceans Past: World History from a Maritime Perspective	STAS	3
HIS 365	HIS	365	Environmental History of North America	ESI STAS	3
HIS 366	HIS	366	Carceral Studies: Histories of Policing, Prisons, and Surveillance	DIV SBS+	3
HIS 368	HIS	368	Health and Disease in Africa	SBS+	3
HIS 369	HIS	369	Religion and Politics in Africa	CER SBS+	3
HIS 370	HIS	370	US Social History from 1860 to 1940	DIV SBS+	3
HIS 371	HIS	371	Law and Society in American History, 1620-1877	DIV SBS+	3
HIS 373	HIS	373	Global 1960s	GLO SBS+	3
HIS 374	HIS	374	Surveillance State: A History of U.S. Domestic Spying	SBS+	3
HIS 379	HIS	379	Rebels & Revolutionaries: 1960s Latin America	GLO SBS+	3
HIS 380	HIS	380	Topics in Latin-American History	SBS+	3
HIS 381	HIS	381	Global Commodity Histories, 1500-2000	DIV GLO SBS+	3
HIS 383	HIS	383	The World of Jane Austen; Jane Austen in the World	HFA+ SBS+	3
HIS 385	HIS	385	Aztec Civilization	ESI SBS+	3
HIS 386	HIS	386	The Maya	SBS+	3
HIS 387	HIS	387	Cuba: Island of Consequence	ESI GLO SBS+	3
HIS 389	HIS	389	Mexico: From Revolutions to Cartels, 1810-2020	DIV SBS+	3
HIS 390	HIS	390	Topics in Ancient History	SBS+	3
HIS 391	HIS	391	Topics in Ancient and Medieval Europe	SBS+	3
HIS 392	HIS	392	Topics in Early Modern Europe	SBS+	3
HIS 393	HIS	393	Topics in Modern European History	SBS+	3
HIS 396	HIS	396	Topics in U.S. History	SBS+	3
HIS 397	HIS	397	Topics in History of U.S. Immigration and Ethnicity		3
HIS 398	HIS	398	Topics in the History of Science, Medicine and Technology	STAS	3
HIS 399	HIS	399	Topics in U.S. History	SBS+	3
HIS 401	HIS	401	Senior Colloquium	EXP+ SPK WRTD	3
HIS 444	HIS	444	Experiential Learning	EXP+	0
HIS 447	HIS	447	Independent Readings in History		1-3
HIS 458	HIS	458	Speak Effectively Before an Audience	SPK	0
HIS 459	HIS	459	Write Effectively in History	WRTD	0
HIS 487	HIS	487	Supervised Research	EXP+	0-6
HIS 488	HIS	488	Internship	EXP+	0-6
HIS 495	HIS	495	Senior Honors Project in History		3
HIS 496	HIS	496	Senior Honors Project in History	EXP+	3
HON 101	HON	101	Introduction to Stony Brook		1
HON 105	HON	105	Modes of Knowledge	CER HUM SBS	3
HON 106	HON	106	Modes of Being	CER HUM SBS	3
HON 110	HON	110	Honors Topics		1
HON 111	HON	111	Honors Topics		1
HON 112	HON	112	Honors Topics		1
HON 113	HON	113	Honors Topics		1
HON 114	HON	114	Honors Topics		1
HON 115	HON	115	Honors Topics		1
HON 116	HON	116	Honors Topics		1
HON 117	HON	117	Honors Topics		1
HON 118	HON	118	Honors Topics		1
HON 119	HON	119	Honors Topics		1
HON 120	HON	120	Honors Topics		1
HON 201	HON	201	The Arts and Society	ARTS	3
HON 301	HON	301	Science, Engineering, Medicine, and Society	CER STAS	3
HON 401	HON	401	Global Issues	DIV GLO	3
HON 475	HON	475	Honors College Teaching Practicum	EXP+	1
HON 495	HON	495	Honors College Senior Project	ESI EXP+ SPK WRTD	3
HON 496	HON	496	Honors College Senior Project	ESI EXP+ SPK WRTD	3
HUE 269	HUE	269	Topics in Contemporary Slavic Culture	GLO HUM	3
HUE 392	HUE	392	Topics in Slavic Studies	HFA+	3
HUE 487	HUE	487	Independent Research		0-6
HUF 211	HUF	211	French Cinema	ARTS	3
HUF 216	HUF	216	French Civilization through the Ages	GLO HUM	3
HUF 219	HUF	219	Modern France	GLO	3
HUF 311	HUF	311	French Literature	GLO HFA+	3
HUF 318	HUF	318	Pan-African Literature I	GLO HFA+	3
HUF 319	HUF	319	Women of the Middle East	GLO HFA+	3
HUF 385	HUF	385	French Caribbean Literature	HFA+	3
HUF 475	HUF	475	Undergraduate Teaching Practicum I	EXP+	3
HUG 221	HUG	221	German Cinema Since 1945	ARTS	3
HUG 229	HUG	229	Germany Today	GLO	3
HUG 321	HUG	321	Topics in the Literature of Germany	HFA+	3
HUI 216	HUI	216	Italian Civilization Through the Ages	GLO	3
HUI 231	HUI	231	Italian Cinema	ARTS CER	3
HUI 234	HUI	234	Introduction to 20th-Century Drama	GLO HUM	3
HUI 235	HUI	235	Love and Tragedy in Early Italian Literature	GLO HUM	3
HUI 236	HUI	236	The Italian-American Scene	HUM USA	3
HUI 237	HUI	237	Images of Italian-American Women	DIV HUM USA	3
HUI 239	HUI	239	Modern Italy	GLO HUM	3
HUI 306	HUI	306	Italian Renaissance Art	HFA+	3
HUI 331	HUI	331	Italian Literature	HFA+	3
HUI 333	HUI	333	The Italian-American Experience in Literature	HFA+	3
HUI 336	HUI	336	Italian Americans and Ethnic Relations	USA	3
HUI 338	HUI	338	Images of Italian Americans in Film	HFA+	3
HUI 390	HUI	390	Italian-American Studies in the Humanities	HFA+	3
HUI 392	HUI	392	Italian-American Studies in the Social and Behavioral Sciences	SBS+	3
HUI 447	HUI	447	Directed Readings in Italian Studies		1-6
HUI 475	HUI	475	Undergraduate Teaching Practicum I	EXP+	3
HUI 476	HUI	476	Undergraduate Teaching Practicum II	EXP+	3
HUL 324	HUL	324	Romance Linguistics	HFA+	3
HUR 141	HUR	141	The Age of Empire	HUM	3
HUR 142	HUR	142	Culture and Revolution	HUM	3
HUR 231	HUR	231	Saints and Fools	CER HFA+	3
HUR 232	HUR	232	Rebels and Tyrants	CER HFA+	3
HUR 235	HUR	235	Crime and Punishment in World Literature	CER GLO HUM	3
HUR 241	HUR	241	Russian Cinema	ARTS	3
HUR 249	HUR	249	Russia Today	GLO HUM	3
HUR 341	HUR	341	Russian Literature and the West	HFA+	3
HUR 393	HUR	393	Literary Analysis of Russian Texts	HFA+	3
HUR 475	HUR	475	Undergraduate Teaching Practicum I	EXP+	3
HUR 476	HUR	476	Undergraduate Teaching Practicum II	EXP+	3
HUS 201	HUS	201	The Hispanic World through Visual Cultures	ARTS DIV	3
HUS 221	HUS	221	Disabled Bodies, National Politics	DIV STAS	3
HUS 250	HUS	250	Caribbean Cultures	DIV GLO HUM	3
HUS 254	HUS	254	Latin America Today	DIV GLO HUM	3
HUS 255	HUS	255	Modern Spain	GLO HUM	3
HUS 261	HUS	261	Latin American Literature in a Global Context	DIV GLO HUM	3
HUS 271	HUS	271	United States Latino Literature and Culture	DIV HUM USA	3
HUS 272	HUS	272	Science, Technology, and the Environment in Latin America	CER STAS	3
HUS 290	HUS	290	Latin American Cinema	ARTS DIV GLO	3
HUS 475	HUS	475	Undergraduate Teaching Practicum in Hispanic Cultures	EXP+	3
IAE 101	IAE	101	Digital Intelligence	ARTS TECH	3
IAP 249	IAP	249	Placeholder Course		0-1
IAP 302	IAP	302	Placeholder course		0-1
IAP 390	IAP	390	Rethinking America: Traditions and Trends		3
IAP 391	IAP	391	American Society and Culture		3
IAP 444	IAP	444	Global Service Learning	EXP+	0-6
IAP 488	IAP	488	Internship	EXP+	0-6
INT 201	INT	201	Democracy and Capitalism		2
INT 401	INT	401	Global Social Problems		3
INT 487	INT	487	Independent Study in International Studies	EXP+	0-6
ISE 102	ISE	102	Introduction to Web Design and Programming	TECH	3
ISE 108	ISE	108	Introduction to Programming	TECH	3
ISE 208	ISE	208	Intermediate Programming		3
ISE 218	ISE	218	Fundamentals of Information Technology		3
ISE 300	ISE	300	Technical Communications	SPK WRTD	3
ISE 301	ISE	301	History of Computing	STAS	3
ISE 305	ISE	305	Database Design and Practice	EXP+ TECH	3
ISE 311	ISE	311	Systems Administration		3
ISE 312	ISE	312	Legal, Social, and Ethical Issues in Information Systems	CER ESI STAS	3
ISE 316	ISE	316	Introduction to Networking		3
ISE 317	ISE	317	Computer Networking II		3
ISE 320	ISE	320	Information Management		3
ISE 321	ISE	321	Introduction to Network Administration		3
ISE 323	ISE	323	Human-Computer Interaction		3
ISE 325	ISE	325	Computers and Sculpture		3
ISE 331	ISE	331	Fundamentals of Computer Security		3
ISE 332	ISE	332	Introduction to Visualization		3
ISE 333	ISE	333	User Interface Development		3
ISE 334	ISE	334	Introduction to Multimedia Systems		3
ISE 337	ISE	337	Scripting Languages		3
ISE 339	ISE	339	Benevolent Computing		3
ISE 340	ISE	340	Design of Computer Games	TECH	3
ISE 364	ISE	364	Advanced Multimedia Techniques		3
